"رقم البيت","البيت","التعبير البلاغي","العنصر البلاغي","الشرح"
"1","أَلَا حَيِّ رَهبَى ثم حَيِّ المَطاليا فقد كان مأنوسًا فأَصبح خاليا","ألا حيّ… حيّ","تكرار","تكرار فعل النداء للتحسّر واستدعاء الماضي وتأكيد الشوق."
"1","أَلَا حَيِّ رَهبَى ثم حَيِّ المَطاليا فقد كان مأنوسًا فأَصبح خاليا","مأنوسًا / خاليًا","طباق سلب","تقابل بين حالين: الأنس مقابل الخلوّ، يبرز التغير الكبير في المكان."

"رقم البيت","البيت","التعبير البلاغي","العنصر البلاغي","الشرح"
"2","فلا عَهْدَ إِلا أَن تَذَكَّرَ أَو تَرَى ثُمَامًا حَوالَيْ مَنصِب الخَيْم باليا","تذكّر / ترى","توزيع","توزيع حالتين: إما أن يتذكّر أو يرى، لتوسيع دائرة الدلالة على آثار الديار."
"2","فلا عَهْدَ إِلا أَن تَذَكَّرَ أَو تَرَى ثُمَامًا حَوالَيْ مَنصِب الخَيْم باليا","تذكر / ترى","عكس","تقابل بين عمل قلبي (تذكّر) وعمل حسيّ (رؤية) لبيان شدّة تعلّق الشاعر بالمكان."
"2","فلا عَهْدَ إِلا أَن تَذَكَّرَ أَو تَرَى ثُمَامًا حَوالَيْ مَنصِب الخَيْم باليا","منصب الخيم","كناية","كناية عن المكان الذي كانت تنصب فيه الخيام، أي بقايا السكن وآثاره."

"رقم البيت","البيت","التعبير البلاغي","العنصر البلاغي","الشرح"
"3","إِلى اللهِ أَشكو أَنَّ بالغَوْرِ حاجةً وأُخرى إِذا أَبصرت نجدًا بَدَا ليا","الغور / نجد","طباق إيجاب","تقابل بين مكانين متضادين في الارتفاع والانخفاض، لإظهار اتساع معاناة الشاعر في كل الجهات."
"3","إِلى اللهِ أَشكو… حاجةً / أخرى","حاجةً… وأخرى","توزيع","توزيع لحاجتين مختلفتين في موضعين مختلفين، للدلالة على تكرّر الهموم وتنوّع أسباب الشكوى."
"3","إِلى اللهِ أَشكو","أشكو إلى الله","كناية","كناية عن شدّة الضيق والعجز، إذ لا يُشكى الأمر إلا إلى الله عند شدّة البلاء."

"رقم البيت","البيت","التعبير البلاغي","العنصر البلاغي","الشرح"
"4","إِذا ما أَراد الحي أَن يتزايلوا وحنت جِمال البين حنت جماليا","يتزايلوا","جناس التصريف","اشتقاق من أصل واحد (زال/يتزايل) يعطي تنغيمًا لفظيًا وتأكيدًا لمعنى الافتراق."
"4","إِذا ما أَراد الحي أَن يتزايلوا وحنت جِمال البين حنت جماليا","حنت جِمال البين","استعارة","شبّه الجمال (الإبل) بمن يحِنّ كالبشر، استعارة مكنية تُبرز ألم الفراق."
"4","إِذا ما أَراد الحي أَن يتزايلوا وحنت جِمال البين حنت جماليا","حنت… حنت","تكرار","تكرار الفعل لبيان شدّة الحنين وكثرة تجدد معاني الوداع."
"4","إِذا ما أَراد الحي أَن يتزايلوا وحنت جِمال البين حنت جماليا","يتزايلوا / حنت","مقابلة","مقابلة بين فعلين: الافتراق (يتزايلوا) والحنين (حنت)، لإبراز تناقض المشاعر مع واقع الرحيل."

"رقم البيت","البيت","التعبير البلاغي","العنصر البلاغي","الشرح"
"5","أَلا أَيها الوادي الذي ضم سيله إِلينا نوى ظمياءَ حُيِّيتَ واديا","ألا أيها الوادي… حييت","أسلوب إنشائي (نداء)","نداء للوادي على سبيل التشخيص، إظهار شدة التعلّق بالمكان."
"5","أَلا أَيها الوادي الذي ضم سيله إِلينا نوى ظمياءَ حُيِّيتَ واديا","حيِّيت واديا","توشيع","زيادة لفظية لإتمام الفاصلة الموسيقية وتوكيد التحية بطريقة بلاغية."
"5","أَلا أَيها الوادي الذي ضم سيله إِلينا نوى ظمياءَ حُيِّيتَ واديا","ضمّ سيله إلينا","استعارة","جعل السيل كأنه جسم يضمّ الأشياء، تشخيص للماء لبيان شدّة اتصال المكان بهم."
"5","أَلا أَيها الوادي الذي ضم سيله إِلينا نوى ظمياءَ حُيِّيتَ واديا","الوادي / سيله","جناس الاشتقاق","علاقة اشتقاق معنوية بين الوادي وسيله لزيادة الترابط الموسيقي والدلالي."

"رقم البيت","البيت","التعبير البلاغي","العنصر البلاغي","الشرح"
"6","تَخَطَّى إِلينا من بعيد خيالُها يخوضُ خُداريًّا من الليل داجيا","تخطّى خيالها","استعارة","جعل الخيال كأنه جسم يمشي ويتخطى، تشخيص للخيال لبيان شدّة حضوره في نفس الشاعر."
"6","تَخُوضُ خُداريًّا من الليل**","تشبيه ضمني","تشبيه حركة الخيال بحركة من يخوض في سواد الليل، دون أداة تشبيه، تقوية لصورة الغموض والبعد.",""
"6","الليل الداجي","مبالغة","وصف الليل بشدّة الظلمة (داجٍ)، مبالغة في تصوير العتمة التي يغيب فيها الخيال ويظهر.",""
"6","خيال / الليل","مقابلة","مقابلة بين «الخيال» (المعنوي) و«الليل» (الحسي)، لإبراز التباين بين الرؤية والظلمة.",""

"رقم البيت","البيت","التعبير البلاغي","العنصر البلاغي","الشرح"
"7","نظرتُ بِرَهْبَى والظعائن باللِّوَى فطارت برهبى شُعبة من فؤاديا","نظرتُ برهبى… فطارت برهبى","تكرار","تكرار كلمة «رهبى» لإبراز أثر المكان في نفس الشاعر وشدّة الارتباط العاطفي به."
"7","فطارَت شُعبة من فؤادي","استعارة","جعل جزءًا من فؤاده كأنه يطير، استعارة للدلالة على شدّة الجزع والحزن عند رؤية الظعائن.",""
"7","برهبى / باللوى","جناس التصحيف","تقارب لفظي باختلاف حرف واحد تقريبًا، يعطي موسيقى لفظية ويقوّي التناسب بين المكانين.",""
"7","رهبى / فؤادي","كناية","التعبير عن فوات شيء من القلب كناية عن شدّة التأثر والوجد.",""

"رقم البيت","البيت","التعبير البلاغي","العنصر البلاغي","الشرح"
"8","فإِنكِ إِن تُعْطِي قليلا فطال ما منعتِ وحلّأتِ القلوب الصواديا","تعطي قليلا / منعتِ","طباق سلب","تقابل بين العطاء والمنع لإبراز قلّة ما تُعطيه وكثرة ما تمنعه."
"8","حلّأتِ القلوب الصواديا","استعارة","صوّر القلوب العطشى كأنها طيور أو دواب تُحلَأ عن الماء (يُمنع عنها)، استعارة للدلالة على حرمانهم من الوصال.",""
"8","تعطي / منعتِ","مقابلة","مقابلة بين الفعلين لزيادة إظهار التناقض بين شحّ العطاء وكثرة المنع.",""
"8","القلوب الصواديا","كناية","كناية عن شدّة التعلّق والمحبة، إذ شبّه القلوب بالعطشى التي تبحث عن الارتواء من وصلها.",""

"رقم البيت","البيت","التعبير البلاغي","العنصر البلاغي","الشرح"
"9","دُنُوَّ عتاقِ الطيرِ للزجر بعدما شَمَسْنَ وولَّيْنَ الخدودَ العواصيا","دنوّ عتاق الطير للزجر","تشبيه","يشبّه حالهن بحال الطير النفيس (العتاق) الذي يُدنى للزجر، تصوير لهيبتهن ونفورهنّ."
"9","شمسن / ولّين","طباق سلب","تقابل بين التشمّس (الظهور والانكشاف) والولاء (الابتعاد والانصراف)، لتصوير تقلّب حالهنّ.",""
"9","الخدود العواصيا","استعارة","وصف الخدود بـ«العواصي» كأنها تمتنع وتتمرّد، تشخيص للخدود للدلالة على شموخهنّ.",""
"9","شمسن / ولين","مقابلة","إبراز التناقض بين فعلين متعاكسين لبيان تغيّر المشهد وتحوّل الحالة.",""

"رقم البيت","البيت","التعبير البلاغي","العنصر البلاغي","الشرح"
"10","تُعَيِّرني الإِخلافَ ليلى وأَفْضَلَتْ على وصلِ ليلى قُوَّةٌ من حباليا","الإخلاف / وصل ليلى","طباق سلب","تقابل بين الإخلاف (نقض الوعد) والوصل، لإبراز التناقض بين ما تُعيّره به ليلى وما يفعله لأجل وصلها."
"10","قوّة من حباليا","كناية","كناية عن شدة التعلّق والثبات على الوصل، كأن وصالها حبال متينة تشدّه إليها.",""
"10","الإخلاف / قوّة الحبال","مقابلة","جمع بين مفهوم الإخلاف ومفهوم القوة والمتانة، لإبراز المفارقة بين الاتهام والفعل الحقيقي.",""
"10","حباليا","جناس التصريف","اشتقاق من حبل/حبال يعطي نغمة موسيقية ويعبّر عن التمسّك والمعنى المجازي للوصال.",""

"رقم البيت","البيت","التعبير البلاغي","العنصر البلاغي","الشرح"
"11","فما أَبصر النارَ التي وضحت له وراءَ جُفافِ الطيرِ إِلا تماريا","أبصر النار / تماريا","عكس","مقابلة بين الإبصار والمراء (الشك)، للدلالة على أنّ الرؤية غير مؤكّدة رغم ظهور النار."
"11","وراء جفاف الطير","كناية","كناية عن بُعد المكان ووعورته، إذ يُذكر الجفاف (اليُبوسة) للدلالة على القفر والبعد.",""
"11","وضحت له النار","استعارة","تصوير النار كأنها تُظهر نفسها له بوضوح، تشخيص للدلالة على قوّة لمعانها رغم بعدها.",""

"رقم البيت","البيت","التعبير البلاغي","العنصر البلاغي","الشرح"
"12","لَحِقْتُ وأَصحابي على كل حُرَّةٍ مَرُوح تُبارِي الأَحْبَشِيَّ المُكارِيَا","تُبارِي الأحبشي المكاري","تشبيه","يشبّه سرعة الناقة (المَروح) بسرعة «الأحبشيّ المكاري» المعروف بخفته وعدوه، لبيان شدّة سرعتها."
"12","على كل حُرّةٍ مروح","كناية","كناية عن القوة والنشاط؛ فالحُرّة من النوق القوية، والمَروح السريعة.",""
"12","مروح / تُبارِي","جناس التصريف","تقارب اشتقاقي يضفي انسجامًا صوتيًا ويبرز معنى المنافسة والسرعة.",""

"رقم البيت","البيت","التعبير البلاغي","العنصر البلاغي","الشرح"
"13","تَرامَيْن بالأَجواز في كل صَفْصَفٍ فأدنين من خَلْجِ البُرين الذفاريا","تَرامَيْن / فأدنين","طباق سلب","تقابل بين البعد (تَرامَيْن) والقرب (أدنين)، لإبراز حركة النوق بين الابتعاد والاقتراب."
"13","تَرامَيْن بالأجواز","استعارة","صوّر السير الشديد والانتشار بالرمي، تشبيه السير الحثيث بانتشار السهام.",""
"13","خلج البرين الذفاريا","كناية","كناية عن موضع فيه نبات وماء، يدلّ على مكان مرغوب تسعى إليه الإبل.",""
"13","تَرامَيْن / أدنين","مقابلة","إبراز التناقض بين الفعلين لزيادة تصوير حركة الإبل واتساع مسيرها في الصحارى.",""

"رقم البيت","البيت","التعبير البلاغي","العنصر البلاغي","الشرح"
"14","إِذا بلَّغت رحلي رجيعٌ أملها نزوليَ بِالمَوْماةِ ثم ارتحاليا","نزولي بالمومّاة ثم ارتحاليا","طباق سلب","تقابل بين النزول والارتحال، لإبراز شدّة تنقّله وتقلّب أحواله في السفر."
"14","رجيع أملها","كناية","كناية عن أن ما يعود إليه من أمل قليل أو ضعيف، أي أنّ أمله في الوصول محدود ومتعبّد.",""
"14","بلغت رحلي","استعارة","جعل «الرحل» كأنه شيء يُبلّغ، أي يُوصل إلى موضع معيّن، تصوير لتمام قطع المسافة.",""
"14","نزولي… ارتحالي","مقابلة","جمع بين حالتي الاستقرار والرحيل لإظهار كثرة تغيّر مواقع الشاعر في الصحراء.",""

"رقم البيت","البيت","التعبير البلاغي","العنصر البلاغي","الشرح"
"15","مُخَفِّقة يهوِي على الهول رَكْبُها قليلا بها ما ينظرون التواليا","يهوِي على الهول ركبها","استعارة","صوّر الركب كمن يهوي مباشرة نحو الهول (الخطر)، مبالغة في شجاعتهم وعدم ترددهم."
"15","قليلًا بها ما ينظرون التواليا","كناية","كناية عن سرعة الركب؛ فلا وقت لديهم للتوالي والنظر خلفهم.",""
"15","يهوِي / ينظرون","مقابلة","جمع بين فعلين متباينين: الاندفاع إلى الأمام (يهوِي) وقلة النظر أو التريّث، لبيان شدّة العجلة.",""
"15","مخفّقة / يهوِي","جناس التصريف","تقارب اشتقاقي يضيف إيقاعًا ويقوّي صورة الحركة العنيفة والسريعة.",""

"رقم البيت","البيت","التعبير البلاغي","العنصر البلاغي","الشرح"
"16","تجول بها موتى الشخاص كأنها قذى غَرَق يُضْحِي به الماء طافيا","كأنها قذى غرق","تشبيه","شبّه اضطراب حركة الركائب بما يطفو فوق الماء من قذى الغرق، تصوير للاضطراب الشديد والاهتزاز."
"16","تجول بها موتى الشخَاص","استعارة","جعل «الشخاص» موتى، أي لا يظهر لهم حراك أو تمييز من شدّة الاضطراب، تصوير للمشهد العنيف.",""
"16","قذى / غرق / الماء طافيا","توشيع","تكرار الألفاظ المرتبطة بالماء والطفو لزيادة قوة الصورة وتفصيل المشهد.",""
"16","قذى غرق / الماء طافيا","مبالغة","مبالغة في تصوير شدّة الاضطراب حتى جعله كقذى الغريق الذي تطفو أجزاؤه.",""

"رقم البيت","البيت","التعبير البلاغي","العنصر البلاغي","الشرح"
"17","لَشَقَّ على ذي الحِلم أن يتبع الهوى ويرجو من الأقصى الذي ليس لاقيا","يتبع الهوى / ذي الحِلم","طباق سلب","تقابل بين «الهوى» و«الحِلم»، لإبراز التناقض بين الانقياد للشهوة ورجاحة العقل."
"17","يرجو من الأقصى الذي ليس لاقيا","كناية","كناية عن طلب غير ممكن أو رجاء لا يتحقق، أي أنّ من يتبع الهوى يتعلّق بما لا يُنال.",""
"17","يتبع / يرجو","مقابلة","مقابلة بين الفعلين لإظهار أثر اتباع الهوى: اتباع يقود إلى رجاء عقيم لا يُدرك.",""
"17","الأقصى / ليس لاقيا","مبالغة","المبالغة في وصف البعد واليأس من اللُّقي لإظهار مدى استحالة الرجاء.",""

"رقم البيت","البيت","التعبير البلاغي","العنصر البلاغي","الشرح"
"18","وكائن ترى في الحي من ذي صداقة وغَيرانَ يدعُو ويلَه من حِذَاريا","ذي صداقة / غَيران","طباق إيجاب","تقابل بين الصديق والغيران لإظهار التناقض في طباع الناس داخل الحي."
"18","يدعو ويلَه من حِذَاريا","كناية","كناية عن شدّة الخوف والتحذّر؛ فهو يدعو بالويل من شدة ما يخشاه.",""
"18","ذي صداقة / غَيران","مقابلة","إبراز التباين بين حالين اجتماعيّين متضادّين: الوفاء مقابل الغيرة.",""
"18","يدعو ويلَه","مبالغة","مبالغة في تصوير الفزع والضعف؛ إذ لا يدعو بالويل إلا من اشتدّت به المخاوف.",""

"رقم البيت","البيت","التعبير البلاغي","العنصر البلاغي","الشرح"
"19","إِذا ذُكرت هند أتيح ليَ الهوى على ما ترى من هِجرتي واجتنابيا","هجرَتي / اجتنابي","جناس التصريف","اشتقاق من الجذر نفسه (هجر/اجتناب) يبرز شدة إصراره على البعد."
"19","أتيح لي الهوى","استعارة","جعل الهوى شيئًا يُتاح ويُعرَض، كأنه فرصة تأتيه رغم بعده، تشخيص للهوى.",""
"19","هجرَتي / الهوى","طباق سلب","تقابل بين الهجر والهوى لإبراز الصراع بين الرغبة القلبية والإرادة العقلية.",""
"19","على ما ترى من هجرتي واجتنابيا","كناية","كناية عن محاولته الجاهدة للبعد رغم شدة ميله، أي أنه يفصح عن قوة الحب رغم المجاهدة.",""

"رقم البيت","البيت","التعبير البلاغي","العنصر البلاغي","الشرح"
"20","خليليَّ لولا أن تظنّا بي الهوى لقلت سمعنا من سكينة داعيا","لولا أن تظنّا بي الهوى","كناية","كناية عن شدّة حيائه وخوفه من أن يُتَّهَم بالميل، فهو يكفّ عن القول لئلا يُظَنَّ به الهوى."
"20","تظنّا بي الهوى / قلت سمعنا","مقابلة","مقابلة بين ظنّ الهوى وبين القول والسماع، لإبراز ما يمنعه من الإقدام على التصريح.",""
"20","سمعنا من سُكينة داعيا","استعارة","تصوير الصوت أو النداء كأنه «داعٍ» يُسمَع من سكينة، تشخيص للنداء.",""

"رقم البيت","البيت","التعبير البلاغي","العنصر البلاغي","الشرح"
"21","قفا فاسمعا صوت المنادي فإنه قريبٌ وما دانيتُ بالود دَانيا","قفا فاسمعا","أسلوب إنشائي (نداء)","استخدام أسلوب النداء للتوجيه والانتباه إلى صوت المنادي، لإبراز شدّة أهميته."
"21","قريبٌ / دَانيا","طباق سلب","تقابل بين القرب الظاهر والقرب الفعلي في الوصل، لإبراز مدى تباين الإدراك والعاطفة.",""
"21","بالود دَانيا","كناية","كناية عن العلاقة القريبة بالحب والمودّة، أي أنّ القرب الحقيقي قائم على المحبة.",""
"21","صوت المنادي / فاسمعا","توشيع","توسيع الفعل والنداء لإبراز أهمية سماع الصوت وتأثيره على المتلقي.",""

"رقم البيت","البيت","التعبير البلاغي","العنصر البلاغي","الشرح"
"22","أَلا طرقت أَسماءُ لا حِين مَطْرَق أَحَمَّ عُمانيا وأَشعث ماضيا","ألا طرقت أسماء","أسلوب إنشائي (نداء)","نداء مباشر لإبراز وقع وصول الأسماء، والتنبيه لشدة الحدث أو وصول الخبر."
"22","أحَمَّ عُمانيا / أشعث ماضيا","طباق سلب","تقابل بين الوضوح (أحَمَّ) والفوضوية (أشعث) لتصوير التباين بين المظاهر.",""
"22","أسماء / مطرق","كناية","كناية عن الصوت المدوّي أو الرسالة المبلغة، أي أنّ مرور الأسماء يحمل خبرًا مهمًا.",""
"22","أحَمَّ / أشعث","مبالغة","مبالغة في وصف حالة الأسماء والشخصيات لتقوية الصورة الحركية والمشهدية.",""

"رقم البيت","البيت","التعبير البلاغي","العنصر البلاغي","الشرح"
"23","لدى قَطَريات إِذا ما تَغَوَّلَتْ بنا البيد غاولن الحُزُوم القياقيا","تغوّلت بنا البيد","استعارة","تصوير البيد (الصحراء) وكأنها تتغوّل وتتسلّط على الشاعر وركبه، لتوضيح صعوبة السفر وشدّة المشقة."
"23","غاولن الحُزوم القياقيا","تشبيه","تشبيه المتسابقين أو الماشين في البيد بالغَوالين، لإظهار صعوبة المسير ومواجهة الطبيعة.",""
"23","تغوّل / غاولن","مقابلة","مقابلة بين فعل الطبيعة وفعل البشر، لإبراز صراع الإنسان مع البيئة.",""
"23","البيد / الحُزوم القياقيا","كناية","كناية عن مدى اتساع الصحراء ومسافة السفر الطويلة التي يقطعها الركب.",""

"رقم البيت","البيت","التعبير البلاغي","العنصر البلاغي","الشرح"
"24","فَحُيِّيتَ مِنْ سَارٍ تَكَلَّفَ مَوْهِنًا مَزارًا على ذي حاجة متراخيا","حُيِّيتَ من سار","أسلوب إنشائي (نداء)","استخدام أسلوب التحية للتعبير عن التقدير وإظهار الاحترام للشخص المارّ."
"24","تكلف موهنًا","مبالغة","تصوير التكلف بالإضعاف والجهد لإظهار صعوبة التحية أو أثرها المرهق.",""
"24","على ذي حاجة متراخيا","كناية","كناية عن الشخص المحتاج أو المريض، أي أنّ التحية جاءت لتخفيف المعاناة أو التعب.",""
"24","سار / متراخيا","مقابلة","مقابلة بين الحركة والنشاط مقابل التراخي والضعف، لإبراز التباين في الصورة والمشهد.",""

"رقم البيت","البيت","التعبير البلاغي","العنصر البلاغي","الشرح"
"25","إِذا ما جعلتُ السِّيَّ بيني وبينها وحرَّةَ ليلى والعَقِيقَ اليمانيا","السي بيني وبينها","استعارة","جعل السي حاجزًا بينه وبينها، أي تصوير الفراق أو البعد كجدار أو مسافة فاصلة."
"25","حرّة ليلى / العقيق اليماني","تشبيه","شبّه جمالها وصفاءها بالعقيق اليماني الثمين، لإظهار جمالها ونفاسة حضورها.",""
"25","السي / ليلى","مقابلة","مقابلة بين الحاجز المادي (السي) وبين جمال الشخص المفقود، لإبراز التباين بين القرب والبعد.",""
"25","حرّة / العقيق","جناس التصريف","تقارب لفظي بين وصف الإنسان ووصف الحجر الثمين لتعزيز الموسيقى الإيقاعية للبيت.",""

"رقم البيت","البيت","التعبير البلاغي","العنصر البلاغي","الشرح"
"26","دعوتُ إِلى ذي العرش ربِّ محمد ليجمعَ شعبًا أو يقرّبَ نائيًا","ليجمع شعبًا / يقرّب نائيًا","طباق سلب","تقابل بين الجمع والقرب، لإبراز قدرة الدعاء على تحقيق ما هو بعيد أو جمع ما تفرق."
"26","إلى ذي العرش ربّ محمد","أسلوب إنشائي (نداء)","نداء لله للتفويض والطلب، يعكس التواضع والخضوع أمام القدرة العليا.",""
