"رقم البيت","البيت","التعبير البلاغي","العنصر البلاغي","الشرح"
"26","شعبًا / نائيًا","كناية","كناية عن الناس القريبين والبعيدين، لتوضيح شمول الدعاء لكل المخلوقات.",""
"26","جمع / قرب","مقابلة","إبراز التناقض بين الفعلين لإظهار تنوع أثر الدعاء بين القرب والبعد.",""

"رقم البيت","البيت","التعبير البلاغي","العنصر البلاغي","الشرح"
"27","ويأمرني العُذال أن أغلب الهوى وأن أخفي الوجد الذي ليس خافيا","أغلب الهوى / أخفي الوجد","طباق سلب","تقابل بين الانقياد للهوى وإخفاء الوجد، لإبراز الصراع الداخلي بين الرغبة والمبادئ."
"27","الوجد الذي ليس خافيا","كناية","كناية عن المشاعر الصادقة والواضحة التي يصعب إخفاؤها، أي أنّ الشاعر يكتم شيئًا ظاهرًا للكل.",""
"27","أغلب / أخفي","مقابلة","مقابلة بين الفعلين لإظهار التناقض بين الفعل الظاهر (أغلب الهوى) والفعل الباطن (إخفاء المشاعر).",""
"27","العذال / الهوى","استعارة","تصوير العذال كسلطة أو قوة توجه الشاعر لإخفاء شغفه، تشخيص للوم الآخرين.",""

"رقم البيت","البيت","التعبير البلاغي","العنصر البلاغي","الشرح"
"28","فيا حسراتِ القلب في إِثْرِ من يُرى قريبًا، ويُلفى خَيْرُهُ منك قاصيا","قريبًا / قاصيا","طباق سلب","تقابل بين القرب والبعد لإبراز ألم الفقد والفراق، وشدّة الحنين إلى المحبوب."
"28","حسرات القلب","كناية","كناية عن شدة الحزن والأسى الذي يعتري الشاعر بسبب البعد أو الفقد.",""
"28","يُرى / يُلفى","مقابلة","مقابلة بين الرؤية المباشرة واللقاء غير المتاح، لإبراز التناقض بين ما يتمناه وما يحصل عليه.",""
"28","قريب / قاصي","جناس التصريف","اشتقاق من القرب والبعد يعطي إيقاعًا موسيقيًا ويقوّي المعنى الشعوري.",""

"رقم البيت","البيت","التعبير البلاغي","العنصر البلاغي","الشرح"
"29","تعرضتُ فاستمررتِ من دون حاجتي فحالَكِ إني مُسْتَمِرٌّ لحاليا","فاستمررتِ / مستمر لحاليا","تكرار","تكرار الفعل «استمرّ» لتأكيد استمرار الفعل وتأثيره على الشاعر."
"29","من دون حاجتي","كناية","كناية عن قيامها بالفعل بلا داعٍ، أي أنّ فعلها زائد على ما يحتاجه الشاعر.",""
"29","حالَكِ إني","استعارة","تصوير حالها وتأثيرها عليه كأنها قوة تحكم المشاعر، تشخيص لحالها.",""
"29","استمررتِ / مستمرٌ","جناس التصريف","تقارب لفظي بين اشتقاقات الفعل لإضفاء إيقاع موسيقي وتأكيد المعنى.",""

"رقم البيت","البيت","التعبير البلاغي","العنصر البلاغي","الشرح"
"30","فَرُدِّي جِمال البينِ ثم تحمّلي فما لكِ فيهم من مُقام ولا ليا","ردّي جمال البين ثم تحمّلي","أسلوب إنشائي (أمر)","استخدام أسلوب الأمر لإظهار الإصرار على إعادة الناقة أو ما يرمز له من الاتصال."
"30","ما لك فيهم من مقام ولا ليا","طباق سلب","تقابل بين المقام والليّة (القرب والبعد) لإظهار التباين بين الحقائق والأماني.",""
"30","جمال البين","استعارة","جعل الناقة كرمز للوصل والبعد، أي أنّ جمالها يعكس العلاقة أو المسافة بينهم.",""
"30","تحملي / فرُدي","مقابلة","مقابلة بين الفعلين لإبراز التناقض بين الفعل المفعول والفعل المأمور به، لتوضيح شدّة الموقف.",""

"رقم البيت","البيت","التعبير البلاغي","العنصر البلاغي","الشرح"
"31","وإني لَمَغْرُورٌ أُعَلِّلُ بالمُنَى لياليَ أَرجو أن مالكَ ماليا","أعلّل بالمُنى","استعارة","جعل التعلّل بالمُنى سببًا للأمل، تصوير للمُنى كوسيلة تبرير للرغبة أو التفاؤل."
"31","أرجو أن مالكَ ماليا","كناية","كناية عن الأمل في الحصول على ما يريد، أي أنّ ما يملكه الطرف الآخر مرغوب عند الشاعر.",""
"31","لمغْرور / أعلّل","مقابلة","مقابلة بين الغرور والرجاء لإظهار تناقض شعور الشاعر بين الفخر والرغبة.",""
"31","ليالي أرجو","مبالغة","مبالغة في طول فترة الأمل والتمني، لإبراز استمرار الشوق والرجاء.",""

"رقم البيت","البيت","التعبير البلاغي","العنصر البلاغي","الشرح"
"32","وقائلةٍ والدمعُ يَحْدُرُ كُحْلَها أَبعْدَ جرير تُكْرِمُونَ المواليا","الدمع يحدر كحلها","استعارة","تصوير الدمع كأنه يسيل من الكحل، تصوير لحالة الحزن والأسى الظاهرة على وجهها."
"32","أبعد جرير تُكرمون المواليا","كناية","كناية عن التباعد في المعاملة أو القرب والبعد في المودة، أي أنّ الكرم أو الشرف بعيد عند البعض.",""
"32","وقائلة / يحدر الدمع","توشيع","توسيع الفعل والصفة لتأكيد أثر الحزن على الكلام والمظهر الخارجي.",""
"32","يحدر / تُكرمون","مقابلة","مقابلة بين انسكاب الدمع وتأثير الآخرين في الكرم، لإظهار التناقض بين المشاعر الداخلية والتصرّف الخارجي.",""

"رقم البيت","البيت","التعبير البلاغي","العنصر البلاغي","الشرح"
"33","بِأَيِّ نجاد تحمل السيفَ بعدما قطعتَ القوى من مِحْمَلٍ كان باقيا","تحمل السيف / قطعت القوى","مقابلة","مقابلة بين حمل السيف والقوة المقطوعة لإبراز الشجاعة والمخاطرة بعد ضعف الطرف الآخر."
"33","محمَلٍ كان باقيا","كناية","كناية عن المكان أو الوضع المستمر، أي أنّ المعركة أو القوة السابقة ما زالت موجودة رغم ما حدث.",""
"33","نجاد / السيف","استعارة","تصوير السيف كأنه جزء من الجسم (نجاد) للدلالة على الانتصار والقوة.",""
"33","تحمل / قطعت","طباق سلب","تقابل بين الفعلين لإظهار التناقض بين الفعل العدواني والفعل المسبق بالقطع، لتوضيح الموقف البطولي.",""

"رقم البيت","البيت","التعبير البلاغي","العنصر البلاغي","الشرح"
"34","بأَي سِنان تطعُن القوم بعدما نزعتَ سِنانًا من قناتك ماضيا","سِنان تطعن / نزعت سنان","تكرار","تكرار لفظ «سِنان» لتأكيد الفعل العدواني وشدّة الهجوم على القوم."
"34","تطعُن القوم","استعارة","جعل الطعن بالسنّان رمزًا للهجوم العسكري أو القوة الموجهة ضد الأعداء، تشخيص للمعركة.",""
"34","نزعت سنان من قناتك","كناية","كناية عن إزالة القوة أو السلاح استعدادًا للقتال، أي أنّ القوة كانت حاضرة ومهيأة.",""
"34","سنان / سنان","جناس التصريف","اشتقاق من نفس الجذر يعطي إيقاعًا موسيقيًا ويقوّي المعنى الشعوري للبيت.",""

"رقم البيت","البيت","التعبير البلاغي","العنصر البلاغي","الشرح"
"35","ألا لا تخافا نَبْوَتِي في مُلِمَّةٍ وخافا المنايا أن تفوتكما بيا","لا تخافا / خافا المنايا","طباق سلب","تقابل بين الفعلين لإبراز التناقض بين الاطمئنان والخوف من الموت أو الفقد."
"35","نبوتي في ملمّة","استعارة","جعل الشجاعة أو الخبرة كأنها شيء ملموس يمكن الاعتماد عليه في المواقف الصعبة.",""
"35","تفوتكما بيا","كناية","كناية عن فقدان الحياة أو الفرصة، أي أنّ الموت قد يسبق أو يحرم من شيء مرغوب.",""
"35","لا تخافا / خافا","تكرار","تكرار الفعلين لزيادة القوة البلاغية وإبراز التناقض بين الأمان والخوف.",""

"رقم البيت","البيت","التعبير البلاغي","العنصر البلاغي","الشرح"
"36","فقد كنتُ نارًا يصطليها عدوُّكم وحِرْزًا لما ألجأتم من ورائيا","كنت نارًا يصطليها عدوكم","استعارة","جعل الشاعر نارًا يتحرق بها الأعداء، تصوير لشدّة قوته وفتكه بالعدو."
"36","وحِرْزًا لما ألجأتم من ورائيا","كناية","كناية عن الحماية والملجأ، أي أنّه حصن لمن وراءه ويحميهم من الأذى.",""
"36","نار / حرز","مقابلة","مقابلة بين القوة والهجوم (النار) والحماية (الحرز) لتوضيح دور الشاعر المتعدد: هجوم ودفاع.",""
"36","يصطليها / ألجأتم","طباق سلب","تقابل بين الضرر الواقع على الأعداء وبين اللجوء أو الحماية للآخرين، إبراز للتناقض في الأثر.",""

"رقم البيت","البيت","التعبير البلاغي","العنصر البلاغي","الشرح"
"37","وباسط خير فيكم بيمينه وقابض شر عنكم بشماليا","باسط خير / قابض شر","طباق سلب","تقابل بين الخير والشر لإبراز تأثير الشاعر الإيجابي والسلبي على الناس."
"37","باسط خير فيكم بيمينه","استعارة","جعل الخير يُبسط باليد اليمنى، تصوير للقوة والكرم والتحكّم بما يناله الناس.",""
"37","قابض شر عنكم بشماليا","استعارة","تصوير الشاعر كحامٍ أو مانعٍ للشر، أي أنّه يقبضه باليد اليسرى، تشخيص للقدرة على الحماية.",""
"37","يمين / شمال","عكس","تقابل اليد اليمنى واليسرى لتوضيح تباين الأفعال بين الإيجاب والسلب.",""

"رقم البيت","البيت","التعبير البلاغي","العنصر البلاغي","الشرح"
"38","وإني لَعَفّ الفقر مشتَرَك الغنى سريع -إذا لم أرض داري- انتقاليا","لَعَفّ الفقر / مشتَرَك الغنى","طباق سلب","تقابل بين الفقر والغنى لإبراز تقلب حال الشاعر وسرعة انتقاله بين الحالين."
"38","سريع إذا لم أرض داري","مبالغة","مبالغة في سرعة انتقاله وتقلّب أحواله، لتوضيح كثرة الحركة وعدم الثبات.",""
"38","لَعَفّ / مشتَرَك","مقابلة","مقابلة بين حالتين متضادتين: البؤس والرخاء، لإبراز التناقض في حياته.",""
"38","انتقاليا","استعارة","تصوير الشاعر كأنه ينقل حاله بنفسه بين الفقر والغنى، تشخيص للظروف المتقلبة.",""

"رقم البيت","البيت","التعبير البلاغي","العنصر البلاغي","الشرح"
"39","جَرِيُّ الجَنان لا أُهال من الردى إذا ما جعلت السيفَ من عن شماليا","جريّ الجنان / لا أُهال من الردى","مبالغة","تصوير الشاعر بالقوة والشجاعة بحيث لا يهاب الموت، مبالغة في وصف الشجاعة."
"39","جعلت السيف من عن شماليا","استعارة","تصوير السيف كأنه يوجّه من جهة محددة، تشخيص للسلاح لإبراز السيطرة والقدرة على الفتك.",""
"39","جريّ / السيف","مقابلة","مقابلة بين النشاط والحركة (جريّ) وبين القوة والهجوم (السيف)، لتوضيح الشجاعة.",""
"39","الردى / شماليا","طباق إيجاب","تقابل بين الخطر (الردى) والموقع الذي يوجّه إليه الفعل (شمال)، لإظهار التباين بين الفعل والنتيجة.",""

"رقم البيت","البيت","التعبير البلاغي","العنصر البلاغي","الشرح"
"40","وليست لسيفي في العظام بقيةٌ وللسيف أشوى وقعًا من لسانيا","لسيفي في العظام / أشوى وقع من لسانيا","طباق سلب","تقابل بين تأثير السيف المادي وتأثير اللسان، لإبراز قوّة الكلام على بعض الأحيان أكثر من القوة البدنية."
"40","ولسيف أشوى وقع","استعارة","تصوير الكلام كالسيف، أي أنّ أثر الكلام مؤلم وقوي كالضرب بالسيف، تشخيص للمجاز.",""
"40","في العظام / من لسانيا","مقابلة","مقابلة بين الفعل المادي والفعل اللفظي، لإظهار الفرق بين القوة الجسدية والقوة اللفظية.",""
"40","سيف / لسان","جناس التصريف","تقارب لفظي بين سيف ولسان لإضفاء موسيقى إيقاعية على البيت.",""