"رقم البيت","البيت","التعبير البلاغي","العنصر البلاغي","الشرح"
"33","وجِيْدٍ كَجِيْدِ الرِّئْمِ","كجيد الرئم","تشبيه","شبّه طول الجيد واعتداله بجيد الظبية البيضاء (الرئم) للدلالة على الرشاقة والنعومة."
"33","لَيْسَ بِفَاحِشٍ إذا هيَ نَصَّتْهُ وَلَا بمُعَطَّلِ","ليس بفاحش ولا بمعطّل","طباق إيجاب","تقابل بين الفحش والتعطّل لإظهار الاعتدال في طول الجيد؛ لا طويل مبالغ فيه ولا قصير ناقص."
"33","ليس بفاحش / ولا بمعطل","جناس التصريف","تقارب لفظي بين (فاحش – معطّل) في الوزن والصيغة مع اختلاف الحروف والمعنى.",""

"رقم البيت","البيت","التعبير البلاغي","العنصر البلاغي","الشرح"
"34","غَدَائِرُهُ مُسْتَشْزَرَاتٌ إلى العُلا","غدائر مستشزرات إلى العلا","مبالغة","مبالغة في تصوير ارتفاع الضفائر وكثافتها كأنها تعلو وترتفع بقوة."
"34","تَضِلُّ العِقَاصُ في مُثَنًّى وَمُرْسَلِ","تضلّ العقاص","استعارة","صوّر تداخل ضفائرها بالعقاص حتى كأنها تضلّ الطريق من شدة التفاوت والطول."
"34","مُثَنًّى وَمُرْسَلِ","توزيع","توزيع لحالات الشعر بين المضفور (مثنّى) والمنسدل (مرسل) لبيان تنوّع جماله وتفصيله.",""

"رقم البيت","البيت","التعبير البلاغي","العنصر البلاغي","الشرح"
"35","وكَشْحٍ لَطِيْفٍ كَالجَدِيلِ مُخَصَّرٍ","كالجَديل","تشبيه","شبّه دقّة خصرها وحسنه بالجديل (الضفيرة)، للدلالة على الرقّة والانسياب."
"35","وسَاقٍ كَأنْبُوبِ السَّقِيِّ المُذَلَّلِ","كأنبوب السقي المذلّل","تشبيه","شبّه ساقها بالأنبوب المستقيم الملساء، لإبراز الاعتدال والطول والنعومة."
"35","كشح لطيف / ساق كأنبوب","مقابلة","تقابل بين وصف الخصر والساق لإبراز جمال متكامل في موضعين مختلفين من الجسد.",""

"رقم البيت","البيت","التعبير البلاغي","العنصر البلاغي","الشرح"
"36","ويُضْحِي فَتِيْتُ المِسْكِ فَوْقَ فِرَاشِهَا","فَتِيتُ المِسْك فوق فراشها","استعارة","تصوير رائحتها القوية بالمسك الذي يتناثر فوق فراشها، مبالغة في الطيب."
"36","نَؤُومُ الضُّحَى","نؤوم الضحى","كناية","كناية عن ترفها ورغد عيشها، إذ تنام حتى الضحى."
"36","لم تَنْتَطِقْ عنْ تَفَضُّلِ","لم تنتطق عن تفضّل","كناية","كناية عن هدوئها ونعومتها ورقتها، فلا تتحرك أو تنطق بتكلّف أو ادّعاء."

"رقم البيت","البيت","التعبير البلاغي","العنصر البلاغي","الشرح"
"37","وتَعْطُو بِرَخْصٍ غَيْرِ شَثْنٍ","تعطو برخص غير شثن","كناية","كناية عن لين يديها ورقّتهما وخلوّهما من الغلظ والخشونة."
"37","كَأنَّهُ أسارِيعُ ظَبْيٍ","كأساريع ظبي","تشبيه","شبّه أصابعها الدقيقة بأساريع الظبي (صغارها أو آثار أقدامها)، للدلالة على الرشاقة والدقّة."
"37","أوْ مَسَاوِيْكُ إِسْحِلِ","مساويك إسحل","تشبيه","تشبيه أصابعها بمساويك شجرة الإسحل المستقيمة الدقيقة، لإبراز النعومة والاعتدال."
"37","أساريع ظبي / مساويك إسحل","توزيع","توزيع لصورتين من الطبيعة (الحيوان – النبات) لتقوية وصف جمال اليدين ودقّتهما.",""

"رقم البيت","البيت","التعبير البلاغي","العنصر البلاغي","الشرح"
"38","تُضِيءُ الظَّلامَ بالعِشَاءِ","تُضيء الظلام","استعارة","صوّر وجهها أو حضورها بضوء يبدّد الظلام، للدلالة على شدة إشراقها."
"38","كَأنَّهَا مَنَارَةُ مُمْسَى رَاهِبٍ مُتَبَتِّلِ","كمنارة ممسى راهب","تشبيه","شبّهها بمنارة مضيئة يهتدي بها الناس، مما يعظّم نورها وسطوعها."
"38","منارة / راهب متبتّل","توزيع","توزيع عناصر الصورة بين المنارة والراهب لإضفاء القداسة والوقار على شدة الضوء.",""

"رقم البيت","البيت","التعبير البلاغي","العنصر البلاغي","الشرح"
"39","إلَى مِثْلِهَا يَرْنُو الحَلِيْمُ صَبَابَةً","يرنو الحليم صبابة","كناية","كناية عن شدّة جمالها، حتى إنّ الحليم الوقور لا يملك نفسه عند رؤيتها."
"39","إذا ما اسْبَكَرَّتْ بَيْنَ دِرْعٍ ومِجْوَلِ","بين درع ومجول","طباق إيجاب","تقابل بين نوعين من اللباس (الدرع – المجول) لإبراز امتلاء الصورة وتفصيلها."
"39","يَرْنُو / صبابة","مبالغة","مبالغة في شدّة التعلّق والانجذاب إليها.",""

"رقم البيت","البيت","التعبير البلاغي","العنصر البلاغي","الشرح"
"40","كَبِكْرِ المُقَانَاةِ البَيَاضَ بِصُفْرَةٍ","كبكر المقاناة البياض بصفرة","تشبيه","شبّه لون بشرتها بلون الناقة البكر الممتزج بياضها بصفرة محبّبة عند العرب."
"40","غَذَاهَا نَمِيْرُ الماءِ غَيْرُ مُحَلَّلِ","غذاها نمير الماء","استعارة","شبّه الماء العذب بالغذاء الذي يزيد اللون صفاءً، وهو تصوير لنقاء البشرة."

"رقم البيت","البيت","التعبير البلاغي","العنصر البلاغي","الشرح"
"41","تَسَلَّت عَمَايَاتُ الرِّجالِ عن الصِّبَا","تسلّت عمايات الرجال","كناية","كناية عن تركه لطيش الشباب وانصرافه عن أخطائه القديمة."
"41","وَلَيْسَ فُؤَادِي عَنْ هَوَاكِ بِمُنْسَلِي","ليس… بمنسلي","طباق سلب","تقابل بين تسلّت (الترك) وليس بمنسلي (عدم الترك) لإظهار المفارقة بين نضجه العام وثبات حبه لها."
"41","فؤادي / هواك","مبالغة","مبالغة في بيان شدّة التعلّق، إذ يجعل قلبه غير قادر على الانسلال من حبّها مهما تغيّر هو.",""

"رقم البيت","البيت","التعبير البلاغي","العنصر البلاغي","الشرح"
"42","ألا رُبَّ خَصْمٍ فيكِ ألْوَى رَدَدْتُهُ","خصم… ألْوَى رددته","كناية","كناية عن دفاعه عنها وردّه لكل من يلومه أو يعاتبه بسبب حبّه لها."
"42","نَصِيْحٍ عَلَى تَعْذَالِهِ غَيْرَ مُؤْتَلِي","نصيح غير مؤتلي","مبالغة","مبالغة في وصف الناصح الذي يُكثر اللوم، ومع ذلك لا يضعف الشاعر أمام نصائحه."
"42","ألْوَى / غير مؤتلي","مقابلة","تقابل بين الخصم الذي يلوّي ويُكثر اللوم وبين الشاعر الذي لا يضعف ولا يتراجع.",""

"رقم البيت","البيت","التعبير البلاغي","العنصر البلاغي","الشرح"
"43","ولَيْلٍ كموجِ البَحْرِ مُلْقٍ سُدُولَهُ","ليلٍ كموج البحر","تشبيه","شبّه الليل بأمواج البحر في شدّته واضطرابه وظلمته."
"43","مُلْقٍ سُدُولَهُ عليَّ","ملقٍ سدوله","استعارة","جعل الليل كمن يلقي ستائر كثيفة على الشاعر ليغمره بالهموم."
"43","بأنواعِ الهُمومِ ليبتلي","ليبتلي","مبالغة","مبالغة في تصوير شدّة الهموم حتى كأنّ الليل يبتليه بها ابتلاءً."

"رقم البيت","البيت","التعبير البلاغي","العنصر البلاغي","الشرح"
"44","فَقُلْتُ لَهُ لَمَّا تَمَطَّى بِصُلْبِهِ","تمطّى بصلبه","استعارة","صوّر الليل أو الدهر ككائن يتمطّى ويتطاول، للدلالة على امتداد الزمن وثقله."
"44","وأرْدَفَ أعْجَازًا ونَاءَ بِكَلْكَلِ","أردف أعجازًا وناءَ بكلكل","استعارة","صوّر الليل كحيوان عظيم يجرّ أعجازه ويثقل بصدره، مبالغة في وصف الثقل والظلمة."
"44","تمطّى / أردف / ناء","جناس الاشتقاق","تقارب اشتقاقي بين الأفعال الثلاثة يعطي إيقاعًا قويًا ويؤكد صورة الثقل والامتداد.",""

"رقم البيت","البيت","التعبير البلاغي","العنصر البلاغي","الشرح"
"45","ألَا أيُّها اللَّيْلُ الطَّوِيْلُ ألا انْجَلِي","ألا أيها الليل… انجلي","تضمين (جريان)","تقاطع هذا النداء مع ما قبله في البيت السابق (الليل المتطاول)، واستمرار الصورة نفسها في سياق جديد."
"45","ألَا أيُّها اللَّيْلُ الطَّوِيْلُ","الليل الطويل","استعارة","استعارة في تصوير الليل ككائن يُنادى ويُخاطَب، للدلالة على شدّة وطأته وطوله."
"45","وما الإصْبَاحُ فِيْكَ بأمْثَلِ","ليس الإصباح فيك بأمثل","الرجوع","رجوع إلى نفي الفرج حتى مع الصباح، تأكيدًا لاستمرار الضيق."

"رقم البيت","البيت","التعبير البلاغي","العنصر البلاغي","الشرح"
"46","فَيَا لَكَ من لَيْلٍ كأنَّ نُجُومَهُ","كأنّ نجومه","تشبيه","شبّه نجوم الليل بشيء مشدود محكم، في صورة قوية الإيحاء بالثبات والكثافة."
"46","بِكُلِّ مُغَارِ الفَتْلِ شُدَّتْ بِيَذْبُلِ","شدّت بيذبل","استعارة","صوّر النجوم كأنها عُقَد أو حبال فُتلت وشُدّت بأوتاد، للدلالة على إحكام الليل وثقله."
"46","مُغار الفتل / شُدّت","جناس الاشتقاق","تقارب اشتقاقي بين ألفاظ تدل على الفتل والشدّ، مما يكوّن إيقاعًا واحدًا للصورة المتخيَّلة.",""

"رقم البيت","البيت","التعبير البلاغي","العنصر البلاغي","الشرح"
"47","كأنَّ الثُّريَّا عُلِّقَتْ في مَصَامِهَا","كأنّ الثريا عُلّقت","تشبيه","شبّه الثريا بعقد مُعلَّق في موضعه، لإبراز ثباتها وارتفاعها وجمالها."
"47","بأمْرَاسِ كَتَّانٍ إلى صُمِّ جَنْدَلِ","بأمراس كتان إلى صم جندل","استعارة","تصوير النجوم كأنها مربوطة بحبال من كتان إلى صخور صلبة، مبالغة في شدّة ثباتها في السماء."
"47","أمراس / صم جندل","توزيع","توزيع عناصر الصورة بين الحبال والصخور لتقوية المشهد وتشبيه إحكام النجوم بإحكام الربط.",""

"رقم البيت","البيت","التعبير البلاغي","العنصر البلاغي","الشرح"
"48","وقِربَةِ أقْوَامٍ جَعَلْتُ عِصَامَهَا","قِرْبَةِ أقوام جعلتُ عصامَها","كناية","كناية عن تحمُّل مسؤوليات قومه وخدمتهم، إذ شبّه نفسه بمن يحمل قربتهم."
"48","على كَاهِلٍ مِنِّي ذَلُولٍ مُرَجَّلِ","كاهلٍ مني ذلول مرجّل","استعارة","شبّه جهده وصبره بالدابة الذلول السهلة القياد، تصويرًا لاحتماله المشاق."
"48","قِربة / عصام / كاهل","توزيع","توزيع لأجزاء الصورة بين القربة وعصامها والكاهل لإبراز ثقل الحمل وتفصيله.",""

"رقم البيت","البيت","التعبير البلاغي","العنصر البلاغي","الشرح"
"49","ووادٍ كَجَوُفِ العَيْرِ قَفرٍ قَطَعْتُهُ","كجوف العير","تشبيه","شبّه الوادي الخالي بجوف حمار الوحش الخالي، للدلالة على شدة الخواء والوحشة."
"49","به الذِّئْبُ يَعْوِي كالخَلِيع المُعَيَّلِ","يعوي كالخليع المعيّل","تشبيه","شبّه عواء الذئب بعواء رجل خالع فقير مُثقل بالديون، للدلالة على شدّة الاضطراب والوحشة."
"49","الذئب يعوي / الخليع المعيّل","توزيع","توزيع بين صوت الذئب وصوت الإنسان المضطرب لزيادة قوّة الصورة الموحشة.",""

"رقم البيت","البيت","التعبير البلاغي","العنصر البلاغي","الشرح"
"50","فقلتُ له لمَّا عَوَى","لما عوى","كناية","كناية عن استحضار صوت الذئب للتعبير عن شدة الوحشة في المكان."
"50","إنَّ شَأنَنَا طَوِيْلُ العَنَا","طويل العَنا","مبالغة","مبالغة في وصف المشقة وطول المعاناة في رحلته."
"50","إنْ كُنْتَ لَمَّا تَمَوَّلِ","عَوَى / العَنا","جناس التصريف","تقارب في الصيغة والوزن بين (عوى) و(العنا) مع اختلاف المعنى، مما يضيف جرسًا موسيقيًا قويًا للبيت."

"رقم البيت","البيت","التعبير البلاغي","العنصر البلاغي","الشرح"
"51","كِلَانَا إذا ما نَالَ شَيْئًا أفَاتَهُ","نال شيئًا أفاته","كناية","كناية عن عدم بقاء الخير في أيديهما، أي أنّهما لا يملكان حفظ ما يصل إليهما من رزق أو مغنم."
"51","ومَنْ يَحْتَرِثْ حَرْثِي وحَرْثَكَ يُهْزَلِ","حرثي وحرثك","جناس الاشتقاق","تقارب اشتقاقي بين الكلمتين (حرثي / حرثك) لإبراز الاشتراك في الحال والمعاناة."
"51","يُهْزَلِ","مبالغة","مبالغة في تصوير شدة الفقر والضيق، حتى إنّ من يحرث لهما يَهْزُل من قلّة العائد.",""

"رقم البيت","البيت","التعبير البلاغي","العنصر البلاغي","الشرح"
"52","وقد أغتدي والطَّيْرُ في وُكُنَاتِهَا","الطيور في وُكُناتها","كناية","كناية عن الفجر والسكينة؛ تصوير الطيور في أوكارها للدلالة على الصباح الهادئ."
"52","بمنجردٍ قَيْدِ الأوَابِدِ هَيْكَلِ","قيد الأوابد هيكل","استعارة","شبّه ترتيب الطيور في أعشاشها بالهيكل المحكم أو الرباط القوي، للدلالة على النظام والدقة في الطبيعة."

"رقم البيت","البيت","التعبير البلاغي","العنصر البلاغي","الشرح"
"53","مِكَرٍّ مِفَرٍّ مُقبِلٍ مُدبِرٍ مَعاً","مكرٍّ مفرٍّ مقبلٍ مدبرٍ معاً","جناس التصريف","تقارب لفظي بين الأفعال الأربعة لتأكيد الحركة الشاملة والمتقلبة."
"53","كَجُلمُودِ صَخْرٍ حَطَّهُ السَّيْلُ مِنْ عَلِ","كجلمود صخر","تشبيه","شبّه تراكم الأفعال أو الحركات بجلمود صخر ألقاه السيل، للدلالة على التراكم والقوة."
"53","مكرٍّ مفرٍّ / جلمود صخر","توزيع","توزيع بين الحركة الإنسانية والصخور لتقوية الصورة المجازية للطبيعة القوية.",""